{
  "meta": {
    "templateId": "ecom_order_confirmation",
    "templateName": "Order Confirmation Email",
    "category": "ecom_bundle",
    "version": "1.0.0",
    "createdAt": "2025-11-03T03:22:37.510Z",
    "updatedAt": "2025-11-15T15:55:44.996321Z",
    "description": "Confirmation email sent after successful order placement"
  },
  "html": "<!-- Order Confirmation Email - Post-Purchase Follow-up -->\n\n<!DOCTYPE html PUBLIC \"-//W3C//DTD XHTML 1.0 Transitional//EN\" \"http://www.w3.org/TR/xhtml1/DTD/xhtml1-transitional.dtd\">\n<html xmlns=\"http://www.w3.org/1999/xhtml\">\n<head>\n  <meta http-equiv=\"Content-Type\" content=\"text/html; charset=UTF-8\" />\n  <meta name=\"viewport\" content=\"width=device-width, initial-scale=1.0\"/>\n  <meta name=\"x-apple-disable-message-reformatting\" />\n  <title>Order Confirmed - Thank You for Your Purchase</title>\n</head>\n<body style=\"margin: 0; padding: 0; font-family: -apple-system, BlinkMacSystemFont, 'Segoe UI', Roboto, 'Helvetica Neue', Ubuntu, sans-serif; -webkit-text-size-adjust: 100%; -ms-text-size-adjust: 100%; background-color: #f8fafc;\">\n  <table border=\"0\" cellpadding=\"0\" cellspacing=\"0\" width=\"100%\" style=\"margin: 0; padding: 0; width: 100%; background-color: #f8fafc;\" role=\"presentation\">\n    <tr>\n      <td align=\"center\" style=\"padding: 20px 0;\">\n        \n        <!-- Main Container -->\n        <table border=\"0\" cellpadding=\"0\" cellspacing=\"0\" width=\"600\" style=\"max-width: 600px; width: 100%; background-color: #ffffff; border-radius: 12px; box-shadow: 0 8px 25px rgba(0, 0, 0, 0.1);\" role=\"presentation\">\n          \n          <!-- Component start Success Header -->\n          <tr>\n            <td align=\"center\" style=\"padding: 40px 20px; background-color: #ffffff; border-radius: 12px 12px 0 0;\">\n              <img src=\"https://images.unsplash.com/photo-1559027615-cd4628902d4a?w=200&h=80&fit=crop&q=80\" alt=\"Order Confirmation Logo\" width=\"180\" height=\"60\" style=\"display: block; width: 180px; height: 60px; margin: 0 auto 20px; border: 0;\" />\n              <h1 style=\"margin: 0; padding-top: 0; padding-bottom: 0; color: #1e293b; font-size: 32px; font-weight: 700; line-height: 38px; font-family: -apple-system, BlinkMacSystemFont, 'Segoe UI', Roboto, sans-serif;\">Order Confirmed!</h1>\n            </td>\n          </tr>\n          <!-- Component end Success Header -->\n          <!-- Component start Order -->\n          <tr>\n            <td style=\"padding: 40px 30px; background-color: #ffffff;\">\n              <table border=\"0\" cellpadding=\"0\" cellspacing=\"0\" width=\"100%\" role=\"presentation\"><tr><td style=\"text-align: center; margin-bottom: 30px;\">\n                <h2 style=\"margin: 0 0 10px 0; color: #1f2937; font-size: 24px; font-weight: 600; line-height: 30px; font-family: -apple-system, BlinkMacSystemFont, 'Segoe UI', Roboto, sans-serif;\">Order #ORD-2024-001234</h2>\n                <p data-element=\"order-date\" style=\"margin: 0 0 20px 0; color: #64748b; font-size: 16px; line-height: 22px; font-family: -apple-system, BlinkMacSystemFont, 'Segoe UI', Roboto, sans-serif;\">Placed on January 15, 2024 at 2:30 PM</p>\n              </td></tr></table>\n            </td>\n          </tr>\n          <!-- Component end Order -->\n          <!-- Component start Product -->\n          <tr>\n            <td style=\"padding: 0 30px 0 30px; background-color: #ffffff;\">\n              <table border=\"0\" cellpadding=\"0\" cellspacing=\"0\" width=\"100%\" role=\"presentation\"><tr><td style=\"border-radius: 8px; padding: 20px; margin-bottom: 15px;\">\n                <table border=\"0\" cellpadding=\"0\" cellspacing=\"0\" width=\"100%\" role=\"presentation\">\n                  <tr>\n                    <td width=\"120\" style=\"padding-right: 15px;\">\n                      <!--[if mso]>\n                      <v:roundrect xmlns:v=\"urn:schemas-microsoft-com:vml\" xmlns:w=\"urn:schemas-microsoft-com:office:word\" style=\"height:120px;v-text-anchor:middle;width:120px;\" arcsize=\"7%\" stroke=\"f\" fillcolor=\"#ffffff\">\n                        <w:anchorlock/>\n                        <v:imagedata src=\"https://images.unsplash.com/photo-1505740420928-5e560c06d30e?w=150&q=80\" />\n                      </v:roundrect>\n                      <![endif]-->\n                      <!--[if !mso]> -->\n                      <img data-element=\"logo\"  src=\"https://images.unsplash.com/photo-1505740420928-5e560c06d30e?w=150&q=80\" alt=\"Wireless Headphones\" width=\"120\" style=\"display: block; width: 120px; height: 120px; border-radius: 6px; border: 0;\" />\n                      <!--<![endif]-->\n                    </td>\n                    <td valign=\"top\">\n                      <h4 data-element=\"product-1-name\" style=\"margin: 0 0 8px 0; color: #1f2937; font-size: 16px; font-weight: 600; line-height: 22px; font-family: -apple-system, BlinkMacSystemFont, 'Segoe UI', Roboto, sans-serif;\">Premium Wireless Headphones</h4>\n                      <p data-element=\"product-1-description\" style=\"margin: 0 0 8px 0; color: #64748b; font-size: 14px; line-height: 20px; font-family: -apple-system, BlinkMacSystemFont, 'Segoe UI', Roboto, sans-serif;\">Color: Black • Qty: 1</p>\n                      <!--[if mso]>\n                      <table border=\"0\" cellpadding=\"0\" cellspacing=\"0\" width=\"100%\" role=\"presentation\">\n                        <tr>\n                          <td align=\"left\">\n                            <p style=\"margin: 0; color: #1f2937; font-size: 16px; font-weight: 600; line-height: 22px; font-family: -apple-system, BlinkMacSystemFont, 'Segoe UI', Roboto, sans-serif;\">$199.99</p>\n                          </td>\n                        </tr>\n                      </table>\n                      <![endif]-->\n                      <!--[if !mso]> -->\n                      <p data-element=\"product-1-price\" style=\"margin: 0; color: #1f2937; font-size: 16px; font-weight: 600; line-height: 22px; font-family: -apple-system, BlinkMacSystemFont, 'Segoe UI', Roboto, sans-serif; text-align: left;\">$199.99</p>\n                      <!--<![endif]-->\n                    </td>\n                  </tr>\n                </table>\n              </td></tr></table>\n            </td>\n          </tr>\n          <!-- Component end Product -->\n          <!-- Component start Order Summary -->\n          <tr>\n            <td style=\"padding: 0 30px 40px 30px; background-color: #ffffff;\">\n              <div style=\"height: 24px; line-height: 24px; font-size: 1px;\">&nbsp;</div>\n              \n              <!-- Order Total -->\n              <table border=\"0\" cellpadding=\"0\" cellspacing=\"0\" width=\"100%\" role=\"presentation\" data-element=\"order-total-container\"><tr><td data-element=\"order-total-container-td\" style=\"display: table-cell !important; background-color: #f1f5f9; border-radius: 8px; padding: 10px; margin-bottom: 25px;\">\n                <table border=\"0\" cellpadding=\"0\" cellspacing=\"0\" width=\"100%\" role=\"presentation\">\n                  <tr>\n                    <td data-element=\"subtotal-label\" style=\"display: table-cell !important; padding: 10px; color: #64748b; font-size: 16px; line-height: 22px; font-family: -apple-system, BlinkMacSystemFont, 'Segoe UI', Roboto, sans-serif;\">Subtotal:</td>\n                    <!--[if mso]>\n                    <td align=\"center\" style=\"display: table-cell !important; padding: 5px 0; color: #64748b; font-size: 16px; line-height: 22px; font-family: -apple-system, BlinkMacSystemFont, 'Segoe UI', Roboto, sans-serif;\">$499.98</td>\n                    <![endif]-->\n                    <!--[if !mso]> -->\n                    <td align=\"right\" style=\"display: table-cell !important; padding: 10px; color: #64748b; font-size: 16px; line-height: 22px; font-family: -apple-system, BlinkMacSystemFont, 'Segoe UI', Roboto, sans-serif; text-align: right; width: auto;\"><span data-element=\"subtotal-amount\" style=\"display: inline; padding: 10px;\" style=\"display: inline;\">$499.98</span></td>\n                    <!--<![endif]-->\n                  </tr>\n                  <tr>\n                    <td data-element=\"shipping-label\" style=\"display: table-cell !important; padding: 10px; color: #64748b; font-size: 16px; line-height: 22px; font-family: -apple-system, BlinkMacSystemFont, 'Segoe UI', Roboto, sans-serif;\">Shipping:</td>\n                    <!--[if mso]>\n                    <td align=\"center\" style=\"display: table-cell !important; padding: 5px 0; color: #64748b; font-size: 16px; line-height: 22px; font-family: -apple-system, BlinkMacSystemFont, 'Segoe UI', Roboto, sans-serif;\">$9.99</td>\n                    <![endif]-->\n                    <!--[if !mso]> -->\n                    <td align=\"right\" style=\"display: table-cell !important; padding: 10px; color: #64748b; font-size: 16px; line-height: 22px; font-family: -apple-system, BlinkMacSystemFont, 'Segoe UI', Roboto, sans-serif; text-align: right; width: auto;\"><span data-element=\"shipping-amount\" style=\"display: inline; padding: 10px;\" style=\"display: inline;\">$9.99</span></td>\n                    <!--<![endif]-->\n                  </tr>\n                  <tr>\n                    <td style=\"display: table-cell !important; padding: 10px; color: #64748b; font-size: 16px; line-height: 22px; font-family: -apple-system, BlinkMacSystemFont, 'Segoe UI', Roboto, sans-serif;\">Tax:</td>\n                    <!--[if mso]>\n                    <td align=\"center\" style=\"display: table-cell !important; padding: 5px 0; color: #64748b; font-size: 16px; line-height: 22px; font-family: -apple-system, BlinkMacSystemFont, 'Segoe UI', Roboto, sans-serif;\">$41.00</td>\n                    <![endif]-->\n                    <!--[if !mso]> -->\n                    <td align=\"right\" style=\"display: table-cell !important; padding: 10px; col